{"schema_version": "1.0.0", "case_id": "case-sensitivity-2026", "analysis_mode": "LOCAL_MVP", "classification": "S2-CONFIDENTIAL", "purpose": "pension_strategy_analysis", "consent_id": "consent-golden-001", "created_at": "2026-08-11T12:00:00Z", "expires_at": "2026-12-31T00:00:00Z", "deletion_status": "ACTIVE", "requested_capabilities": ["CONTRIBUTION_RECONCILIATION", "CONTRIBUTION_GAP", "FLEXIBLE_EMPLOYMENT_CONTRIBUTION", "SUBSIDY_ELIGIBILITY", "SUBSIDY_TIMING", "SCENARIO_COMPARISON", "RECOMMENDATION", "SENSITIVITY_ANALYSIS", "PENSION_ESTIMATION"], "facts": [{"fact_id": "base-1", "fact_type": "contribution_base", "value": "7000.00", "as_of_date": "2026-08-11", "source_ref": "base-limits", "required_for": ["FLEXIBLE_EMPLOYMENT_CONTRIBUTION"]}, {"fact_id": "agg-1", "fact_type": "aggregate_count", "value": 179, "as_of_date": "2026-08-11", "source_ref": "statement", "required_for": ["CONTRIBUTION_RECONCILIATION", "CONTRIBUTION_GAP"]}, {"fact_id": "mon-1", "fact_type": "contribution_month", "value": "2026-06", "as_of_date": "2026-08-11", "source_ref": "statement", "required_for": ["CONTRIBUTION_RECONCILIATION"]}, {"fact_id": "mon-2", "fact_type": "contribution_month", "value": "2026-07", "as_of_date": "2026-08-11", "source_ref": "statement", "required_for": ["CONTRIBUTION_RECONCILIATION"]}, {"fact_id": "employment_difficulty_recognized", "fact_type": "subsidy_input", "value": true, "as_of_date": "2026-08-11", "source_ref": "user", "required_for": ["SUBSIDY_ELIGIBILITY"]}, {"fact_id": "employment_registration_days", "fact_type": "subsidy_input", "value": 45, "as_of_date": "2026-08-11", "source_ref": "user", "required_for": ["SUBSIDY_ELIGIBILITY"]}, {"fact_id": "has_earned_income", "fact_type": "subsidy_input", "value": true, "as_of_date": "2026-08-11", "source_ref": "user", "required_for": ["SUBSIDY_ELIGIBILITY"]}, {"fact_id": "paid_unemployment_premium_before", "fact_type": "subsidy_input", "value": true, "as_of_date": "2026-08-11", "source_ref": "user", "required_for": ["SUBSIDY_ELIGIBILITY"]}, {"fact_id": "months_to_retirement", "fact_type": "subsidy_input", "value": 36, "as_of_date": "2026-08-11", "source_ref": "user", "required_for": ["SUBSIDY_TIMING"]}, {"fact_id": "subsidy_months_used", "fact_type": "subsidy_input", "value": 0, "as_of_date": "2026-08-11", "source_ref": "user", "required_for": ["SUBSIDY_TIMING"]}, {"fact_id": "application_month", "fact_type": "subsidy_input", "value": "2026-08", "as_of_date": "2026-08-11", "source_ref": "user", "required_for": ["SUBSIDY_TIMING"]}, {"fact_id": "pension_paid", "fact_type": "subsidy_input", "value": true, "as_of_date": "2026-08-11", "source_ref": "user", "required_for": ["SUBSIDY_ELIGIBILITY"]}, {"fact_id": "medical_paid", "fact_type": "subsidy_input", "value": true, "as_of_date": "2026-08-11", "source_ref": "user", "required_for": ["SUBSIDY_ELIGIBILITY"]}, {"fact_id": "unemployment_paid", "fact_type": "subsidy_input", "value": true, "as_of_date": "2026-08-11", "source_ref": "user", "required_for": ["SUBSIDY_ELIGIBILITY"]}, {"fact_id": "p-birth", "fact_type": "birth_year_month", "value": "1976-02", "as_of_date": "2026-08-11", "source_ref": "input", "required_for": ["PENSION_ESTIMATION"]}, {"fact_id": "p-gender", "fact_type": "gender_category", "value": "MALE", "as_of_date": "2026-08-11", "source_ref": "input", "required_for": ["PENSION_ESTIMATION"]}, {"fact_id": "p-total", "fact_type": "total_contribution_months", "value": 360, "as_of_date": "2026-08-11", "source_ref": "input", "required_for": ["PENSION_ESTIMATION"]}, {"fact_id": "p-index", "fact_type": "average_contribution_index", "value": "1.0", "as_of_date": "2026-08-11", "source_ref": "input", "required_for": ["PENSION_ESTIMATION"]}, {"fact_id": "p-deemed", "fact_type": "deemed_years", "value": "3.0", "as_of_date": "2026-08-11", "source_ref": "input", "required_for": ["PENSION_ESTIMATION"]}, {"fact_id": "p-balance", "fact_type": "account_balance", "value": "100000.00", "as_of_date": "2026-08-11", "source_ref": "input", "required_for": ["PENSION_ESTIMATION"]}, {"fact_id": "p-cping", "fact_type": "c_ping_override", "value": "12049.00", "as_of_date": "2026-08-11", "source_ref": "input", "required_for": ["PENSION_ESTIMATION"]}, {"fact_id": "s-tiers", "fact_type": "sensitivity_index_tiers", "value": "[0.6, 1.0, 1.5, 2.0, 3.0]", "as_of_date": "2026-08-11", "source_ref": "input", "required_for": ["SENSITIVITY_ANALYSIS"]}]}